{
  "schemaVersion": "1.0.0",
  "units": "m",
  "note": "室内ドアの配置インスタンス。type は data/door-catalog.json の type を参照する。wallAt+orientation+center で位置を表す（wallAtは壁の固定座標、centerはその壁沿いの位置）。ブラウザの配置編集機能から書き出したファイル。data/interior-doors.json に上書きしてコミットすること。",
  "items": [
    {
      "id": "door-001",
      "type": "door-slide",
      "wallAt": 0.91,
      "orientation": "V",
      "center": 2.33,
      "floor": 1,
      "slideDir": "L",
      "label": "トイレ⟷玄関",
      "status": "verified"
    },
    {
      "id": "door-002",
      "type": "door-hinged",
      "wallAt": 2.73,
      "orientation": "H",
      "center": 2.26,
      "floor": 1,
      "hingeSide": "L",
      "swingDir": "out",
      "label": "玄関⟷洗面脱衣室",
      "status": "verified"
    },
    {
      "id": "door-003",
      "type": "door-hinged",
      "wallAt": 4.55,
      "orientation": "H",
      "center": 1.37,
      "floor": 1,
      "hingeSide": "R",
      "swingDir": "out",
      "label": "洗面脱衣室⟷UB",
      "status": "verified"
    },
    {
      "id": "door-004",
      "type": "door-hinged",
      "wallAt": 2.73,
      "orientation": "H",
      "center": 1.38,
      "floor": 1,
      "hingeSide": "R",
      "swingDir": "out",
      "label": "玄関⟷LDK張り出し",
      "status": "verified"
    },
    {
      "id": "door-005",
      "type": "door-slide",
      "wallAt": 2.73,
      "orientation": "V",
      "center": 2.27,
      "floor": 1,
      "slideDir": "R",
      "label": "玄関⟷洋室",
      "status": "verified"
    },
    {
      "id": "door-006",
      "type": "door-open-arch",
      "wallAt": 2.73,
      "orientation": "H",
      "center": 8.22,
      "floor": 1,
      "label": "ヌック⟷LDK",
      "status": "verified"
    },
    {
      "id": "door-007",
      "type": "door-hinged",
      "wallAt": 2.73,
      "orientation": "H",
      "center": 9.56,
      "floor": 1,
      "hingeSide": "L",
      "swingDir": "in",
      "label": "自宅玄関・ホール⟷LDK",
      "status": "verified"
    },
    {
      "id": "door-008",
      "type": "door-hinged-wide",
      "wallAt": 10.92,
      "orientation": "V",
      "center": 0.94,
      "floor": 1,
      "hingeSide": "L",
      "swingDir": "out",
      "label": "自宅玄関⟷土間",
      "status": "verified"
    },
    {
      "id": "door-009",
      "type": "door-slide",
      "wallAt": 2.275,
      "orientation": "H",
      "center": 13.2,
      "floor": 1,
      "slideDir": "L",
      "label": "SC⟷LDK",
      "status": "verified"
    },
    {
      "id": "door-010",
      "type": "door-slide",
      "wallAt": 15.471,
      "orientation": "V",
      "center": 2.28,
      "floor": 1,
      "slideDir": "R",
      "label": "LDK(キッチン部)⟷廊下",
      "status": "verified"
    },
    {
      "id": "door-011",
      "type": "door-slide",
      "wallAt": 1.82,
      "orientation": "H",
      "center": 16,
      "floor": 1,
      "slideDir": "R",
      "label": "ファミリークローク⟷廊下",
      "status": "verified"
    },
    {
      "id": "door-012",
      "type": "door-hinged-wide",
      "wallAt": 2.73,
      "orientation": "H",
      "center": 17.75,
      "floor": 1,
      "hingeSide": "L",
      "swingDir": "in",
      "label": "トイレ(東)⟷洗面(東)",
      "status": "verified"
    },
    {
      "id": "door-013",
      "type": "door-slide",
      "wallAt": 3.64,
      "orientation": "H",
      "center": 16.84,
      "floor": 1,
      "slideDir": "L",
      "label": "廊下⟷脱衣室",
      "status": "verified"
    },
    {
      "id": "door-014",
      "type": "door-hinged-wide",
      "wallAt": 17.291,
      "orientation": "V",
      "center": 4.58,
      "floor": 1,
      "hingeSide": "L",
      "swingDir": "out",
      "label": "脱衣室⟷UB(東)",
      "status": "verified"
    },
    {
      "id": "door-015",
      "type": "door-hinged-wide",
      "wallAt": 6.37,
      "orientation": "H",
      "center": 16.83,
      "floor": 1,
      "hingeSide": "L",
      "swingDir": "out",
      "label": "脱衣室⟷南土間",
      "status": "verified"
    },
    {
      "id": "door-016",
      "type": "door-hinged-wide",
      "wallAt": 1.82,
      "orientation": "H",
      "center": 13.27,
      "floor": 2,
      "widthOverride": 0.7,
      "hingeSide": "L",
      "swingDir": "out",
      "label": "トイレ(2F)⟷廊下(2F)",
      "status": "verified"
    },
    {
      "id": "door-017",
      "type": "door-hinged-wide",
      "wallAt": 2.73,
      "orientation": "H",
      "center": 15.02,
      "floor": 2,
      "hingeSide": "R",
      "swingDir": "out",
      "label": "廊下(2F)⟷子供部屋1",
      "status": "verified"
    },
    {
      "id": "door-018",
      "type": "door-hinged-wide",
      "wallAt": 16.38,
      "orientation": "V",
      "center": 2.28,
      "floor": 2,
      "hingeSide": "R",
      "swingDir": "out",
      "label": "廊下(2F)⟷子供部屋2",
      "status": "verified"
    },
    {
      "id": "door-019",
      "type": "door-hinged-wide",
      "wallAt": 2.73,
      "orientation": "H",
      "center": 15.93,
      "floor": 2,
      "hingeSide": "L",
      "swingDir": "out",
      "label": "廊下(2F)⟷夫婦寝室",
      "status": "verified"
    },
    {
      "id": "door-020",
      "type": "door-open",
      "orientation": "D",
      "x0": 9.1,
      "z0": 1.365,
      "x1": 10.92,
      "z1": 1.82,
      "floor": 1,
      "label": "自宅玄関⟷自宅ホール（斜め框）",
      "status": "estimated",
      "note": "新規(2026-08-15)：施主指摘により斜め框（目分量の角度）に、壁のないドアなしの開口として配置。room-1f-08/room-1f-19の境界と一致させること。施主指摘により角度を緩やかに変更後、同じ角度のまま0.455下へ平行移動"
    },
    {
      "id": "door-021",
      "type": "door-open",
      "wallAt": 12.451,
      "orientation": "V",
      "center": 1.37,
      "floor": 1,
      "widthOverride": 1.82,
      "label": "土間⟷SC",
      "status": "estimated"
    },
    {
      "id": "door-022",
      "type": "door-open",
      "wallAt": 1.82,
      "orientation": "H",
      "center": 15.02,
      "floor": 1,
      "label": "階段⟷パントリー",
      "status": "estimated"
    },
    {
      "id": "door-023",
      "type": "door-fold",
      "wallAt": 2.73,
      "orientation": "H",
      "center": 16.84,
      "floor": 1,
      "hingeSide": "L",
      "swingDir": "out",
      "label": "廊下⟷収納",
      "status": "estimated"
    },
    {
      "id": "door-024",
      "type": "door-double-swing",
      "wallAt": 6.37,
      "orientation": "V",
      "center": 3.01,
      "floor": 1,
      "widthOverride": 1.25,
      "swingDir": "in",
      "label": "洋室⟷収納",
      "status": "estimated"
    },
    {
      "id": "door-025",
      "type": "door-open",
      "wallAt": 1.82,
      "orientation": "H",
      "center": 1.82,
      "floor": 1,
      "widthOverride": 1.82,
      "label": "玄関(民泊)⟷ホール(民泊)",
      "status": "estimated"
    },
    {
      "id": "door-026",
      "type": "door-double-fold",
      "wallAt": 3.64,
      "orientation": "H",
      "center": 13.65,
      "floor": 2,
      "swingDir": "out",
      "label": "子供部屋1⟷クローゼット",
      "status": "estimated"
    },
    {
      "id": "door-027",
      "type": "door-double-fold",
      "wallAt": 16.38,
      "orientation": "V",
      "center": 0.91,
      "floor": 2,
      "swingDir": "out",
      "label": "子供部屋2⟷クローゼット",
      "status": "estimated"
    },
    {
      "id": "door-028",
      "type": "door-open",
      "wallAt": 3.64,
      "orientation": "H",
      "center": 17.75,
      "floor": 2,
      "widthOverride": 2.73,
      "label": "夫婦寝室⟷書斎",
      "status": "estimated"
    },
    {
      "id": "door-029",
      "type": "door-open",
      "wallAt": 1.82,
      "orientation": "H",
      "center": 14.106,
      "floor": 1,
      "widthOverride": 0.91,
      "label": "LDK⟷階段",
      "status": "estimated",
      "note": "新規(2026-08-15)：階段の実体表現にあたり新設。階段の直進部分（西側柱状部分）はLDKに向けて壁のない開口で開放されているリビング階段として配置。room-1f-10/room-1f-11の境界と一致させること。W07-H(2026-09-12)：汎用door-openの既定高さ2mで生成された垂れ壁が、正本13段を上る際の頭上に干渉することを実メッシュのレイ検査・UE歩行で確認。既存注記の「壁のない開口で開放されているリビング階段」に合わせ、室の既定天井高さ2.4mまで開放する仮設定を明示。実測・施工図に基づく確定寸法ではなくestimatedのまま施工確認待ち。幅・位置・段割りは変更しない。",
      "heightOverride": 2.4
    },
    {
      "id": "door-030",
      "type": "door-open",
      "wallAt": 1.82,
      "orientation": "H",
      "center": 14.5605,
      "floor": 2,
      "widthOverride": 1.819,
      "label": "階段(2F)⟷廊下(2F)",
      "status": "estimated",
      "note": "新規(2026-08-15)：階段の実体表現にあたり新設。2F階段室の全幅を廊下(2F)に向けて壁のない開口で開放。room-2f-02/room-2f-03の境界と一致させること"
    },
    {
      "id": "door-031",
      "type": "door-open",
      "wallAt": 17.291,
      "orientation": "V",
      "center": 3.185,
      "floor": 1,
      "label": "廊下⟷洗面(東)",
      "status": "estimated",
      "note": "新規(2026-08-16)：施主指摘により追加（前回配置し忘れていた）。room-1f-13/room-1f-15の共有区間(z:2.73-3.64、幅0.91)全体を壁のない開口で開放"
    }
  ]
}
